{
  "schema_version": 2,
  "tenant_id": "33333333-3333-4333-8333-333333333333",
  "tenant_slug": "tenant-b",
  "business_name": "Tenant B",
  "merchant_name": "Tenant B",
  "merchant_name_acknowledged": true,
  "locale": "en-SG",
  "currency": "SGD",
  "timezone": "Asia/Singapore",
  "canonical_origin": "https://tenant-b.example.com",
  "surface_routes": {
    "public": "/",
    "admin": "/admin",
    "kds": "/kds",
    "database": "/database"
  },
  "qris_asset": "tenant://tenant-b/qris.png",
  "table_count": 12,
  "require_table_qr_signature": true,
  "menu_seed": "prototype/menu.example.json",
  "admin_owner_email": "owner-b@example.com",
  "storage": {
    "namespace": "tenant-b",
    "static_bucket": "merchant-static",
    "payment_bucket": "payment-proofs"
  },
  "sheets": {
    "provider": "google_drive",
    "start_year": 2026,
    "years": 5,
    "expected_tabs": [
      "Dashboard",
      "Data Pemesan",
      "Data Pesanan Makanan",
      "Data Pesanan Minuman",
      "Riwayat Pembayaran"
    ],
    "template_set": "smart-cashier-annual-2026-2030-v1"
  }
}
